[
  {
    "slug": "jordan-ieee-day-2026",
    "titleEn": "Jordan IEEE Day 2026",
    "categoryEn": "IEEE Day",
    "date": "2026-10-14",
    "locationEn": null,
    "summaryEn": "The nationwide IEEE Day celebration in Jordan.",
    "bodyEn": [],
    "image": null,
    "link": null
  },
  {
    "slug": "ieee-day-hu-2026",
    "titleEn": "IEEE Day HU 2026",
    "categoryEn": "IEEE Day",
    "date": "2026-10-20",
    "locationEn": "The Hashemite University",
    "summaryEn": "The IEEE Day celebration at the Hashemite University.",
    "bodyEn": [],
    "image": null,
    "link": null
  }
]
